Year,Semester,Class,Type,Section,Alma ID,Essay: 3
2021,Summer,PHYS 0232,--,1,3058,"What is the governing equation for field strength relative to distance?For a circular magnet with a radius of R and length L, the field Bx at the centerline of the magnet at distance X from the surface can be calculated by the following formula, where Br is the residual induction of the material):"
2021,Summer,PHYS 0232,--,1,3040,"A question for a concept that was covered in class is how are an electric field and electric potential related to work?	From our Electric Potential Lab, we learned that if a charge is moving in a uniform electric field, the work done by the electric field is 𝑊𝐸 = 𝐹 ∙ 𝑟 = 𝑞𝐸 ∙ 𝑟. The direction and movement of the charged particle play a role in determining how much work is done. If the particle moves in the direction perpendicular to the electric field lines, the work done would be zero, because the equation 𝑊 = 𝐹 ∙ ∆𝑟 = 𝐹∆𝑟𝑐𝑜𝑠𝜃 = 𝐹∆𝑟𝑐𝑜𝑠90° = 0. If a positively charged particle moves in the same direction as the electric field lines, the work done would be positive.  From the simulation, we placed the charged particle and sensor charge based on the diagram in the lab. We observed how the terms are related to each other. For example, the potential difference between two of the sensor charges does not depend on the path, but rather just the difference in voltage between the two points. Once we understood the relationship between the terms, such a relationship could be written as E = -V/r, where E is the electric field, V is the electric potential, and r is the distance.	This information can be generally applicable to people’s lives and could be used to benefit society, because it can be applied to many electrical appliances. One example is an incandescent light bulb that is turned off. Electric potential energy is just electricity, so it exists wherever that uses electricity. Our daily appliances such as televisions, lights, phones, anything with electricity. For the specific case of the incandescent light bulb, even when it is turned off, there is still energy and electricity flowing through. The electric potential energy is being stored, ready to do work when the light switch is flipped. Thus, electrical energy is often electrical potential energy until some force is applied to make the charged particle do work and convert the energy to kinetic energy."
2021,Summer,PHYS 0232,--,1,3070,"A question I used to ask myself before I attended a physics class was “Why do opposite charges attract while similar charges repel?”. I later learned that there is an electric field and the direction of the field is given by the charged source. If it is negative, the field will go towards the charge. Vice versa would happen for a negative charge. By that logic, if 2 like charges are put together. They would end up repelling each other since their forces would be directed against each other which would create a repelling force. An application would be the compass. The compass has a magnetic needle which will react to a magnetic field. Since the Earth has 2 magnetic poles which are the north and south poles, it allows the compass to help a person navigate."
2021,Summer,PHYS 0232,--,1,3066,"My question is “how does the use of circuits benefit our life?”So we learn how the charges flow through the simple circuit. But the circuits can be more complicated than what we learn. But since there are some components in the circuit playing a very important role to control the circuit. So the circuits can have a few more properties to be monitored in order to perform some tasks. And based on these tasks, such as switch 0 and 1 (or sometimes we call off and on), scientists build up the complicated task. Then we see different kinds of circuits in our world right now. Anything related to electricity has circuits inside to help control and perform tasks. It is even in the charger! Because it needs to read how strong the voltage/potential difference is and export the corresponding voltage at the output side. But this is not all of the benefits of circuits. The existence of them makes people think we can use them for more complicated tasks, such as mathematical calculation. Then we have some kind of programming language to do those tasks, but also can perform other tasks, such as writing softwares. It gives more and more functionalities just on this circuit, even though a product can have thousands or billions of circuits, but the combination of them eventually benefits us for efficiency on something."
2021,Summer,PHYS 0232,--,1,3071,"It was mentioned somewhere that homes were wired in parallel, why is that important?Homes are wired in parallel for several key reasons:If one item connected to the circuit fails, everything else will continue to run and be connected to the circuit, if it had been in series, everything in the house would stop working if one thing was not workingAdding additional items to the circuit does not reduce the effectiveness of anything already plugged in, for example, turning on your lights does not reduce the amount of power going to your microwave, and vice versa.The overall electric current in the circuit increases with each additional item added, and a dangerously high current can be prevented by having a circuit breaker activate and disconnect that circuit before any additional damage is done. The house can be split into several parallel circuits each responsible for powering different portions of the house, and they all follow the same principles described above."
2021,Summer,PHYS 0232,--,1,3077,"How does a capacitor work?In a sense, a capacitor is a bit like a battery. Although they work in very different ways, both can store electricity. One of the more important uses of capacitors is in conjunction with inductors to form oscillators. A metal plate attached to the capacitor to the battery's negative pole will absorb electrons produced by the battery. A metal plate attached to the capacitor to the battery's positive pole will release electrons into the battery. After charging, the capacitor has the same voltage as the battery.Sometimes capacitors are used to store electricity so that it can be released at high speed. This is the feature used in the flash. Large lasers also use this technique to achieve a very bright flash of light. Capacitors also eliminate pulsation. If the line carrying DC voltage has pulsations or spikes, capacitors can smooth the voltage by absorbing the peaks and filling the troughs. A capacitor can block direct current. If a smaller capacitor is connected to the battery, no current will pass between the two poles of the battery after the capacitor has been charged (a process that can be done in a fraction of a second when capacitors are small).However, any alternating current (AC) signal can flow through the capacitor unimpeded. The reason for this is that the capacitor constantly charges and discharges as the alternating current fluctuates as if the alternating current were flowing. One of the more important uses of capacitors is in conjunction with inductors to form oscillators."
2021,Summer,PHYS 0232,--,1,3076,"How magnetic field work ? The magnetic field exists in the ground and around us. the magnetic field can be around a magnet or a wire carrying a continuous electric current in one direction and known as magnetostatics field. through any running current in blenders, hairdryers or any wire the magnetic field will be generated around. Flowing electrons help compensate electric machines and wiring in our homes, they all produce magnetic fields. magnetic field is the force of magnetism acts on the region surrounding a moving electric charge. as long as magnetic field cannot be seen in real life it might be difficult to understand at first without knowing actual practical experiments for many people. A set of magnetic field lines that follow the direction of the field at each place can be used to see the field. Fortunately, we are able to  use enough information and put it into real life experience of magnets. Magnets are used extensively in modern medicine. it is not only found in compasses that we use to help us travel around and know directions not get lost but also, they're found in devices like the magnetic resonance imaging (MRI) machine and the growing field of magnetic pulse fields, which are utilized to treat Parkinson's disease."
2021,Summer,PHYS 0232,--,1,3069,"What are superconductors and how do they work? Superconductors are a type of conductor with metal and compounds that have no resistance and they way they function is that they get under a certain temperature. There are many ways we can utilize superconductors to help people and to mention a few of them, we can use them in bullet trains as bullet trains float using superconducting magnets that eliminate friction and energy loss as they can carry a lot of energy with no heating, thus allowing the train to go at high speeds. We can also use them in medical fields such as MRI scans. Modern MRI scanners use superconducting magnets to scan as they are smaller and more efficient in delivering energy than regular magnets. They are also very useful to use in computer chips as they speed the connection between different computer chips thus making computers more efficient energy and performance wise. They can also be used to make generators and motors and give us a much lighter motor or generator with the same output as a copper wire  but with an increased efficiency of 99% with half the size. I think superconductors could be used in so many things to improve the world from all aspects. "
2021,Summer,PHYS 0232,--,1,3043,"What are capacitors and how do they work?Before I did the project, I wasn't really sure what capacitors were and now that I know, I know that I didn't know them correctly. I pretty much only knew them in name, and they were important, and something about 2 plates. I had to do some digging around and for the most part, I had to see the animation of electrons moving to be able to understand how it really worked. After that, I did see how it could be used, conceptually. For example, my initial analogy was thinking about using a water dispenser. The dispenser we use at home flips the big bottle upside down and drains down. The thing is that there's a little tank which holds a bit of water so after the bottle is empty, it could fill 3-4 more 500mL bottles. This was probably the better example to use, but personally I'm not the best at essay writing/stuff like that, and I needed something to be more of a hook and drawn interest. I went for Hercules and greek mythology that had a very similar water usage concept, but was not as clear as the water dispenser. But I think with a more interesting topic, it would be easier to learn for some people."
2021,Summer,PHYS 0232,--,1,3041,"Topic: electrical potentialHow can we conceptualize electric potential, especially in relation to current and resistance? I find electric potential confusing, namely because it reminds me of potential energy. By definition, an electric field (a vector) is equal to the negative of the change in potential (a scalar). Thus the potential difference between two points in a field is the negative of the line integral of the electric field between those two points. Usually one of the points, the reference point, is decided to be infinity. Potential is useful because it helps us answer the question: how much work has to be done in order to move a charge from point a to point b? So, the potential difference between two points is equal to the work per unit charge needed to move a charge from one point to the other. "
2021,Summer,PHYS 0232,--,1,3059,"I remember being very confused about Gauss's Law and flux in general. Now, having heard about Current, I question how the relationship between the two can help me better understand how Gauss's Law and Flux affect Current and circuitry, since I believe both are quantities describing charge going through something.I remember Flux being described as being proportional to the amount of field lines going through a surface area. Mathematically it was defined as an integral of electric fields over every small bit of area and can also be defined as charge over permittivity. Current on the other hand was described as the ratio between the amount of charge that passes through a certain amount of time. Looking at the later parts of Chapter 23, they seem to be using pictures that look closer and closer to circuitry components used in later chapters. The idea of a constant electric field and infinite planes of charge become important for the later concepts of equipotential and the construction of wiring."
2021,Summer,PHYS 0232,--,1,3061,"The concept of short circuit I believe is an important topic that everyone should at least briefly understand.  In elementary school or middle school, we probably learned how to light up a small lightbulb with a small battery and some tin foils.  This teaches us how to induce electricity to electronics we'd like to turn on.  As adults, we can still apply this concept to our homes and cars.  Short circuit happens often in homes and cars because (one of the many possible reasons) too much electricity is flowing in the circuit and the system opened the circuit to prevent explosions.  What if the system didn't open the circuit?  Then it's up to us to have an understanding of the Ohm's law and how much voltage is being fed to the circuit.  We need to understand the electronics we use and make sure not to overload the system and have a possible explosion."
2021,Summer,PHYS 0232,--,1,3067,"For the short circuit lab we did last week, the simple concept is using one more wire that is parallel connecting with the original circuit, and the enhanced current will cause the added wire to overload and break. My question is, if the short circuit is dangerous, why it could be used in daily life as a tool instead of a desaster? Well, the unintentional short circuit will be causing burnout, but the intentional short circuit is controllable and we can use the concept of the short circuit to do something useful, such as the circuit breaker, which is a device that could help to protect the main circuit that is overloaded by connecting too many high power appliances"
2021,Summer,PHYS 0232,--,1,3044,"A question I have regarding Electric Fields is how does electric field lines look around a point of charge? Well when we did our lab for this week we were able to visualize it by using a simulation, we got to put one positive point and see the electric fields react to it. Then we did the same thing with a negative point. Another way to be able to visualize Electric fields patters is by being able to look at electric field lines. Lines begin on positive and end on negative. When it comes to the line density it is proportional to the strength of the field, when line close together it means that E is stronger and when they are further apart it means that E is weaker. There are definitely electric fields everywhere. The lines can not cross. One way to also be able to visualize electric fields is with field vectors. When it comes to the direction of the E-field is out of a positive charge and into a negative charge. We use arrows to represent the direction of the E-field and the length of the vector represent the strength. We also got to use the simulation to test these regarding how close or how far the point was as well if it was a positive or negative charge, this would determine how it would react."
2021,Summer,PHYS 0232,--,1,144,"I think the super conductors are an incredibly fascinating concept that we briefly touched on, I had thought that they ability to move objects with zero resistance would provide a way to build trains that ride on superconductor rails, although that was quickly dispelled when we had talked about the energy required to keep a super conductor below its critical temperature. Critical temperature is the temperature at which the material exabits properties of a super conductor, that is 0 electrical resistance. I still believe that super conductors could potentially have some amazing utility. I think super conductors could be used in computing to speed up the current running through the logic gates and moving bits. This would not only increase a processors throughput but the 0 electrical resistance would greatly reduce the production of heat and energy consumption. Introducing a mechanism that would greatly reduce heat and energy consumption alone would be an incredible feat for the future of computing."
2021,Summer,PHYS 0232,--,1,2104,"What are parallel and series combinations?Parallel and series refers to how components in electric circuits are combined/connected together. Essentially, components (of the same kind) connected in a series are connected to each other in a way that the current goes through both objects. Components in a parallel are connected in a way that the current hits a junction and flows through one or another component. An example of a series connection in everyday life is Christmas lights. In Christmas lights the light bulbs are connected in a long chain and the current passes through all of them in one loop. If one of the light bulbs go out/breaks then none of the other light bulbs will light up because the current cannot pass through the broken bulb and thus the circuit is open. An example of a parallel  combination is car headlights. When one of the headlights goes out the other will still function because both lights have individual loops so the flow if the current is independent from the functionality of all the lights. In general the more components/obstacles added to a series circuit, the more the current will decrease. The more components/obstacles added to a parallel circuit (more loops), the more the current will increase."
2021,Summer,PHYS 0232,--,1,3052,"what is Current ? we learned in class in chapter 26 that Current is the rate at which charge flows through a surface  and that if change in Q is the amount of charge that passes through a time in a surface then the average current would be equal to  I = change in Q divided by the change in time what then is Resistance ? , also in chapter 26 we learned that the resistance of a conductor is a property of a conductor at a certain temp. and measures or shows the level of opposition of that material to the flow if electricity  R is Measured by dividing change in voltage the current Does conductivity and resistivity depend on the strength of an electric field - the answer is no conductivity and resistivity do not depend on the strength of an electric field which is the characteristic of a conductor.what are superconductors? super conductors are materials whose resistance decreases to zero when are get below a certain temperature How do you define power and what is the formula for power ? power is the rate at which electrical energy is transferred by an electric circuit. its formula is P = I times change in voltage. "
2021,Summer,PHYS 0232,--,1,3056,"From the past few weeks, I chose the topic of electric fields, and the question I want to ask is ""How do electric fields represent the charge of any object?"" From my notes, I remember that electric fields are fields which surround electrically-charged objects that can extend infinitely in space. The form of an electric field depends on the charge of an object; for example, if an object contains positively charged protons, the electric field extends outwards in infinitely many directions, and if another object contains negatively charged electrons, the field points inwards to the object. If the charge of an object changes, then the direction of the electric field changes as well; its magnitude is not affected by this.Electric fields help people gain an intuitive sense of electric charges in objects, and how they attract or repel each other. It can also represent the dichotomy of extroversion and introversion. In society, we typically perceive extroverts, people who are outgoing and energized by social interactions, as a positive trait, while introverts, people who are more withdrawn and prefer less social interactions, are seen in an (unfair) negative light. Like positively charged objects extend outwards, extroverts extend their social status to larger groups of people, while introverts are more attuned to their own personal feelings and ideals, focusing their energy inward like a negatively charged object."
2021,Summer,PHYS 0232,--,1,3072,"Subject Current and Resistance: In this section, we focused on solving for resistance, and charge. In the beginning, I didn't really understand. As there was more explanation and diagrams of the problem it became easier to understand what was happing. Current and Resistance, I think are an important subjects. Mostly because in our everyday life we use electricity where current and resistance are at play. For example in a homework assignment that made me think and understand better was question 15. Which states that a popcorn popper is rated at 1.11kW when connected to a 120 V source. What current does the popcorn carry? What is its resistance? To calculate the current we used the following formula I = P/V which gives us 9.25A. Then using the formula P =(v^2)/R we can make it equal to R leading us to this formula R = (v^2)/P and getting 12.97Ω.In the current age we are today people are relying on electronic technology and to be able to improve our way of life. Therefore the subject of current and resistance is important."
2021,Summer,PHYS 0232,--,1,2113,"So far we have been learning about a lot of things. These topics are anywhere from Electric Fields, Electric Potential, Currents, Resistance, and to different physics laws. Many things always come up in physics and these topics are always used in everyday life. For example, the main topic that can be used in everyday life that we have already gone over would be statics. When you are doing your laundry you can feel the static electricity on the clothes or when you want to hang a balloon on the wall, you can rub it on your socks or your head and it will stick to the wall. You can dig deeper into physics and it is very easy to be able to find how physics can be used in our everyday lives. Not only does physics relate back to real life situations but in more diverse ways. The different laws explain to us how each topic and segment of physics is used and how it interests into life itself. We have different charges and from those charges cause other charges and it all starts from small charges and protons and neutrons altogether. Physics is a very fascinating topic and it will be easy to catch on once you get the hang of it. "
2021,Summer,PHYS 0232,--,1,3063,"So far we have been finding out about a great deal of things. These themes are anyplace from Electric Fields, Electric Potential, Currents, Resistance, and to various material science laws. Numerous things consistently come up in material science and these themes are constantly utilized in regular day to day existence. For instance, the primary theme that can be utilized in regular daily existence that we have effectively gone over would be statics. At the point when you are doing your clothing you can feel the friction based electricity on the garments or when you need to drape an inflatable on the divider, you can rub it on your socks or your head and it will adhere to the divider. You can delve further into physical science and it is extremely simple to have the option to discover how physical science can be utilized in our regular day to day existences. In addition to the fact that physics relates back to genuine circumstances in more assorted manners. The various laws disclose to us how every point and section of material science is utilized and how it interests into life itself. We have various charges and from those charges cause different charges and everything begins from little charges and protons and neutrons inside and out. Physical science is an exceptionally captivating point and it will be not difficult to get on once you get its hang. A concept that was covered in class was the way a cyclotron works. I watched a video to get a better understanding of it. "
2021,Summer,PHYS 0232,--,1,2521,"One topic I want to focus on that was covered in past few weeks was Ohm's Law. Formulaically, I understand the definition of Ohm's Law as it is just the voltage is equal to the current multiplied by the resistance. However, a question I would create would ask, how would you define Ohm's Law from a conceptual point of view? I would respond to this with saying that Ohm's law states that the current would increase through the circuit as the potential difference increases and if there's more resistance, then the current would decrease proportionally. Ohm's Law helps us observe how electricity operates within a closed circuit, as well as help us analyze how the electric current's behavior plays a role in the circuit's structure as a whole. This could be useful when modifying or troubleshooting an already built circuit, or building one entirely from scratch. It's useful in that having the knowledge regarding the correlation between voltage, current, and resistance will aid you in figuring out how the components of the circuit work."
