Year,Semester,Class,Type,Section,Alma ID,Essay: 3
2021,Summer,PHYS 0232,--,1,145,Electric fields was a concept we learned. In this lab we learned that opposite attract while same signs repel. This can help us in our everyday life since a lot magnets are in electronics and so are negative and positives such as electrons and protons. Magnets are a great example of opposites attract. Magnets in electric generators turn mechanical energy into electricity which is why we need to know how magnets work. If something is done incorrectly it can cause a problem. The problem can make the machine not work or even worse it can make the machine overload since the energy is not placed correctly. 
2021,Summer,PHYS 0232,--,1,3057,"What are charges and what is it used for? Well, electric charges contain two types of charges, positive and negative. When two charges that are the same interact with each other, they repel each other. On the other hand, when two charges are opposite from one another, they attract each other. With electric charges, we would create an electric field where will create a field with vectors and have which have multiple properties depending on the situation. With the positive charge in an electric field, the vector arrows point away from the charge however if it were to be a negative charge the vector arrows point toward the negative charge. Also, the vector is greater when it is close to the charge. With these changes, we can talk about the magnetic fields which are due to moving electric charges. With magnetic fields, we are able to create different types of device such as motors and generators that use magnetic fields."
2021,Summer,PHYS 0232,--,1,3042,"Can a short circuit cause a fire? A short circuit is a low resistance connection between two conductors that provide electrical power to a circuit. This can happen when there is an excessive amount of current flow in the power source through the short. Short circuits are dangerous especially in power sources with high voltage because it can release a lot of heat energy. The excessive amount of heat can build up in the wire and it can cause sparks or combustion. If this is close to flammable objects it could cause a fire if not properly extinguished. It is important to understand what can cause short circuits and how to prevent them. This information can be applied to everyday situations because many home appliances can have a short circuit and being aware of what causes it can help prevent a house fire. For example, space heaters, extension cord, electrical outlet, cables, and more."
2021,Summer,PHYS 0232,--,1,2118,What is the average current? Electric current?Average current is the amount of charge that passes through the surface in a certain time interval. The average current is equal to the charge that passes per unit time. The average current is zero in AC circuits. Current is where the charge passes by a certain point on the circuit. The electric current is where the charge passes through a cross-section in the conductor in a time interval of time. The unit for current is amper where one amper is equal to one Coulomb per second. 
2021,Summer,PHYS 0232,--,1,3053,Originally I didn't understand how electric flux worked. If I recall correctly it's how much the electric field flows through a given area. Φ = EAcos(Θ) is the electric flux formula. The electric field can be broken up into infinitely small pieces and each piece treated as a point charge. The electric field may not be uniform so the formula only works for small areas. Gauss's law states the charge in an enclosed area divided by the amount of charge the material lets through is the same as the total electric flux let out of the area. The relationship between the net electric flux through a closed surface and the charge enclosed by the surface is Gauss’s law. To choose a gaussian surface to take advantage of the symmetry of charge distribution so E can be removed from the surface integral at least one of the following must be satisfied
2021,Summer,PHYS 0232,--,1,3046,"At the beginning of this class we all learn about the electric charge, and the electric field, in that moment I just feel so confused; How would those things affect our life? I know the field force is here, but they are invisible, and I have never seen them in my life. After a week of study, I understand the basic concept of the electric charge and how the electric fieldwork. In my understanding, electric charge is a very tiny material in the region space, they could repel and attract each other so they could create a strong force when the amount of them gathering together, and that is what we side the field force. But still, I have no idea how would it be used daily; Until we learned how would the electric field collaborates with the magnetic field, and how we transform the field forced to torque. As we learned, a charged coil could act as a magnet, and compare with the permanent magnet the electric magnet is highly controllable. So people wound multiple coils on a shaft and put magnets on both sides, when we electrify the coil, the field force will interact with the magnet on the side and rotate the shaft; That is how the electric motor works. Compared with the traditional ones, the electric motors are quieter and more powerful due to the smaller frictional area, and it is wild use in the living space, for example, washing machines and electric fans. "
2021,Summer,PHYS 0232,--,1,3068,"The concept that I chose is short Circuit... We talked about the circuits and shortage within them... The question that I had is why would a circuit burn out if its connected end to end to another one. Then when we did the lab and connected batteries and closed the circuit the foil burned out because it was too thin and could not withhold the energy and therefore the shortage occurred. This information might be helpful to people when they build houses, build pc's or just simply connecting electricity to the technology... you should never give an energy the cable that will not hold the energy that is passing through it. It is very useful context which helped me understand the electricity more in depth. I also feel like in everyday life the electricity is super important since none of us can live without phones, computers,tablets especially during this pandemic we need electricity... There are times when people need to connect the cables in their PC's and sometimes the shortage occurs because the flow of the current was greater than what the cable could hold leading to burned out cable or burned out technology."
2021,Summer,PHYS 0232,--,1,2456,"we've been going through many of electrical physics concepts, one lab concept that I find amazingly is the electric circuit that we did last week for many reasons, it explains a lot of the things around us like the electricity and light bulbs on our homes, like why sometimes in traffic lights when one light broke all of rest broke, but in Christmas light if one light or more in the chain broke the rest will keep on working normally? getting to know the electric circuit arounds us is extremely beneficial for the society"
2021,Summer,PHYS 0232,--,1,3048,"What makes an RC Circuit? - An RC circuit is a circuit containing a series combination of a resistor and a capacitor. When a capacitor is charged, charges do not jump across the capacitor plates because the gap between the plates represents an open circuit. Instead, the charge is transferred between each plate and its connecting wires due to the electric field established in the wires by the battery until the capacitor is fully charged. As the plates are being charged, the potential difference across the capacitor increases. The value of the maximum charge depends on the voltage of the battery. When the maximum charge is reached, the current in the circuit is zero because the potential difference across the capacitor matches that supplied by the battery. When you discharge a capacitor, the capacitor begins to discharge through the resistor. "
2021,Summer,PHYS 0232,--,1,3075,Is it safe to touch the terminals of a high-voltage capacitor even after the voltage source that charged the capacitor is disconnected from the capacitor?NO. It is extremely dangerous because the capacitor is still holding the charge received from the battery. If we were to touch our fingers would act as a pathway for electric discharge shocking and harming us. I feel like this information would be beneficial or generally applicable to people's lives as it can help them and people around them be safe in case they are in a situation where they need to handle a possibly charged capacitor. They can ground it or short circuit the capacitor to remove the residual charge.
2021,Summer,PHYS 0232,--,1,3047,"Why do resistors in parallel make a smaller Req than resistors in series?Since there are 2 paths that the current can take (one through each resistor) it is easier for the current to flow. Because it is easier for the current to flow the resistors are applying less resistance overall since the current has become more easily moving. In series the current must all pass through one resistor without any other path to take. Then  after passing through that resistor the current must then pass through another resistor which slows it down even further. This is making a bigger resistance than the parallel resistors because all of the current must pass through both resistors without any way to make the current flow easier. In parallel, there are 2 paths, like 2 lanes on a highway vs one, so the current flows easier and increases. By Ohm's law, V=IR and V is constant so when the current increases the resistance must decrease to keep the same V. This is somewhat hard to picture but I think thinking about it like an extra lane for traffic and then using that concept and relating it to Ohm's law helps to show the reason why parallel resisters would decrease the resistance and in series would increase it. Series would be something like a stop sign and then another stop sign in the movement of the cars versus parallel being adding an extra way through the stop sign for half the cars to take instead."
2021,Summer,PHYS 0232,--,1,3055,"Why is current so important, when we know the voltage?I first thought that when looking at electric charge we really only needed to consider  the difference in charge and that the current was somewhat secondary as it only defines the rate at which the charge changes over time. Most appliances are denoted by their voltage of 120 volts, at least in America. When we see electrical warning signs it says high voltage. We know that we need power adapters to change from 220V etc. to 120V if we travel abroad. I never fully appreciated what current was, but I think that learning about the resistance and ohm's law helps to contextualize the need to consider current as an integral part of the electric power system. When we examine resistance we see that the voltage is directly tied to the current and resistance. And when we look at Power we see it is not tied to Voltage but the Current and Resistance. So I realize now that Current is just as important if not more important than voltage. Current shows how the energy flows through the circuit and can accurately show how energy navigates a circuit and how the balance of energy flow is maintained when running. "
2021,Summer,PHYS 0232,--,1,3051,"Why do we care about circuits? I think circuits are one of the most important concepts to understand because our society is constantly evolving around technology such as our phones and computers, that use circuits in order for them to work. Obviously, it becomes more and more complex for a better version of technology, but understanding the basics and what it takes for something that we use daily is important. We talk about the flow of electrons or the current. I bet a lot of people don't know how electricity actually works and instead just think ""oh, lightbulb turn on"". We forget why our devices aren't water proof as water is conductive, creating short circuits. We don't realize what we are doing to our devices is actually ruining them. Another, example of magnetic and electric fields is when we get a keycard to a hotel. If we put the keycard next to our phone it changes the electric/magnetic fields on the card making the card dysfunctional. Physics is around us every day and we don't realize how much we take it for granted until we fully learn about it. "
2021,Summer,PHYS 0232,--,1,3049,"So I really like chapter 22 - Electric force. One question in it would be why is it important. I think electric force is important because without it you wouldn't have anything. Anyways, since this is like 200-300 words I will just write something. Well one thing is that there are cockroaches in my house. And the cockroaches are like everywhere so yesterday I was sleeping outside. In my backyard and when I was sleeping in my backyard, a racoon, a huge racoon, whose eyes where glowing was I saw him and he saw me and I ran for my life. and hide behind a stool. And the racoon came and slept on my bed and I was like ""hai ram."" So the next day I told this story to my parents, and siblings and finally they called a guy who would help to spray the cockroaches. Ok and then for tomorrow everyone is like cleaning the house and taking the things out so that the guy can easily spray gas. I am sooooo thank ful for the guy who is gonna spray the cockroaches. Its not like I hate any animals, insects or anyone. I wouldn't mind if a cockroach would just come and stay but they keep on multiplying and multiplying so they are making it hard for me to live thus this cockroach killing is going to happen. I do feel a little bad because the cockroaches also have family but if one family wants to stay they can but not the whole family reproduction thing. "
2021,Summer,PHYS 0232,--,1,3045,"A question that comes to my mind directly after learning about forces and acceleration is that how does gravity affect our daily lives? This topic is related to our mass, yet it is interesting enough to see that gravity helps us do many things. Being able to put our laptop on a table, sitting down on a chair, and sleeping on the bed without flying in the air is all due to gravity, since its gravitational force dragged us towards the near center of earth. Secondly, having gravitational accelerations also benefits us from being away with a certain distance from the sun, making the environment easy to live in, without experiencing extreme temperatures. We will not be able to breath fresh air since the atmosphere has already filed away. Our human body also requires gravity to live, since our muscles and different body parts also depend on gravity. I cannot imagine how normal lives will go without gravity, as humans will start to die, and our earth will become another mystery outer planet since humans can no longer live on Earth. Humans will not exist also, since as humans started to die, there are no more humans left on the planet."
2021,Summer,PHYS 0232,--,1,3064,"The concept that stood out to me that I found is applicable to people's lives and benefit others is on electric fields. This field is a field that surrounds electrically charged particles and exerts force on all the charges that are on this field. The force can be attracting these particles or repelling them. There are so many common items that we use in our everyday life that involve electric fields, such as touch pads or friction. An example could be with a balloon on carpet or rubbing your feet with socks on on a carpet. You create friction and the positive and negative charges on the field are being moved around from one object to another. In our electric field lab, we used simulations that mimicked these situations, and were able to predict what charges go where in these situations. This is a simple thing that most people have interaction with that we don't realize includes electric fields."
2021,Summer,PHYS 0232,--,1,2121,"During week’s 3 and 4 we continued the discussion of electricity and voltages and circuits. From the lab that week one major conclusion is that is that we would have a higher potential difference when we connect batteries in series rather than in parallel. During our lab we used created an electric circuit using 3 1.5V AA batteries and some aluminum foil, and we arranged the batteries in series to create a high enough potential difference to melt a small piece of the aluminum. We can apply this principle to many household items and appliances. Many house appliances work on an electric circuit, and we can conclude that it relates a lot to fuses in our houses' fuse wires, because the wires in the fuses are selected in a way which holds just enough. If the amount of potential energy is larger than what the wire can hold it will cause a combustion - protecting our system/technology from having lots of damage. We also talked about potential difference and During our lab we used a simulation to to build models between two charges, knowing the distance between a +1 nC charge and two other charges, we were able to calculate the voltage and potential difference."
2021,Summer,PHYS 0232,--,1,2126,"A concept that we went over is circuit. For example, what is a circuit? What are the different types of circuit and what do they consist of? A circuit is a closed loop of wire where electrons can travel. This will be in the form of current which can supply households, businesses, etc. There is a direct current (DC) and alternating current (AC) circuit. A direct current is where the current flows in one direction. An alternating current is where the current changes direction periodically. A circuit can have a resistor, capacitor, inductor, and a battery. It also doesn’t have to be one of each, but it could be multiple batteries and/or resistors. A circuit is very helpful in our world because that is how we can connect with our world. When we connect the tv and the WI-FI to the source in the wall we are able to see the news and check our social medias. Additionally, it’s a necessity in order to survive. Literally today in the morning I didn’t have electricity, and I was asking myself how I am going to join my class now. I had to bring the flashlight to use the bathroom. Luckily the power came back 10 minutes before the class started. "
2021,Summer,PHYS 0232,--,1,3073,"Circuit breakers and Fuses in Electrical WiringsThis is our daily life experience when each new light is turned on, it makes all the lights in the house dimmer. What will happen when we switch ON all the lights and all the appliances at the same time? How circuit breakers and fuses protect us from a partial or complete breakdown? Electrical wirings are designed in a smart way, such that in case of any malfunctioned electrical appliance is switched on, immediately a circuit breaker or a fuse comes into action and disconnects the electric supply partially or completely depending upon the design of wirings. Partial breakdown makes us understand that wiring was designed into sections for different rooms/kitchens etc., which are completely isolated from one another and are controlled by their respective circuit breakers or fuses. So, in case there is any electric disorder in a section, it will be disconnected automatically from the rest of the home to keep the rest safe and functioning. The study of series and parallel circuits helps us to understand that how the electrical wirings should be designed and where to put the circuit breakers. In series circuits, there is only one path for the current to flow and which passes through all the connected components. So, when any of the components within a series circuit is broken down or switched off, it will disconnect the rest of the components from the power source and let them stop working. So, this is not wise to install such a setup at our home wirings. To avoid the disconnectivity of the other components from the power source, they are connected in parallel, providing current the multiple paths, so if one component is not working, the current can pass through the others and keep the devices connected and functioning. But at the same time when they are running parallel to each other, they all are consuming electrical energy, which may result in a heavy flow of current which when crosses the limit can damage the electric wirings. This discussion suggests putting the circuit breakers or fuses in series, so in case of the heavy flow of current for any reason, they will trip and keep the rest of the components safe. "
2021,Summer,PHYS 0232,--,1,597,"Learning about currents is a important concept to learn. And that is because anybody who have running electricity would need to learn about this concept, which currents run through out our households. And learning about currents have helped developed technology that we can’t imagine living without today. It’s also important to know about currents in case the electricity in your home goes out because it could mean there’s too many things plugged in for the current flow. "
2021,Summer,PHYS 0232,--,1,3054,"When I reflect back on this summer class, I think the thing that was most intriguing was the difference between batteries in parallel vs in series.  One question that I had was does putting batteries in series decrease the life span of those batteries? This may be a silly question because the voltage is higher, so theoretically it should at least have a harder strain on the batteries which would decrease the lifespan.  But a part of me is wondering if this system works like an accelerator where a large voltage is output at little expense, the only strain being on the wires and batteries.  As I do some google searching that part of me wondering of no expense at higher voltage seems really silly now.  Obviously at a higher voltage the battery life would decrease.  It's interesting, this website says it actually is significantly more costly to use batteries in series and the ratio isn't exactly 1 for 1.  This is why companies don't just add batteries in series whenever they need higher voltage and instead they use bigger batteries.  Very very cool!  "
2021,Summer,PHYS 0232,--,1,189,"The use of circuits in my honest opinion can be used to help people understand certain things happening within their homes. I don't want to come of as a dunce when I say this, however it isn't until recently from this previous lab that we  completed where I started to understand the mechanisms of the electrical circuits around my house. The last lab specifically highlighted a moment of reflection where we were supposed to answer why some  fuse boxes seem to shut off. In a parallel circuit, in order to protect an element, the fuse will shut off by opening the whole circuit. In a way, this can help me especially because my fuse always seems trip out. I never knew this was a self protecting mechanism from the fuse box. In a way, this is kind of genius, if my understanding is correct. From this observation one can conclude that by connecting the fuse again, the problem can be resoled easily. I always saw my dad tinkering with the fuse box every time it would shut off. I always thought we was performing some complex mechanism in order to make the fuse work again. Meanwhile he was switching it from on to off again after the circuit decided to open, lol so helpful yet anti-climatic."
2021,Summer,PHYS 0232,--,1,3074,"After studying the sixth chapter of the physics book, we have learned the concept of Newton's third theorem. Every force will have an equal and opposite reaction force. When I was learning the concepts in the book and completing the practice assignments, I was attracted to a question. The question is: ""A person is in the elevator and standing on the scale, calculate the person's weight by using the weight displayed on the scale when the elevator starts to move upwards and the weight displayed on the scale after the elevator stops."" I think this is A very interesting experimental question. Because as far as we know, the weight displayed on the scale when the elevator rises must be heavier than usual. But why? After drawing a picture, I found that when the elevator is ascending, the weight displayed on the scale is the sum of the weight plus the gravity mg. When the elevator is stopped, the weight displayed on the scale is the difference of the weight minus the gravity mg. So we can add the two weights and divide them by two to get the weight of the person we want.This is really a topic that interests me very much, and it makes me more familiar with the concepts in the book!"
2021,Summer,PHYS 0232,--,1,3060,"I would like to talk about the concept of Ohm's Law. My question is when will the current in a conductor be proportional to the voltage in that conductor? Well, Ohm's Law states that the current through a conductor between two points is directly proportional to the voltage across the two points. Given Ohm's Law, we can calculate the voltage in a conductor by the formula: V = IR [I = Current; R = Resistance]. This Ohm's Law principle has a lot of everyday uses and applications and can be found in a lot of everyday electronics. First of all, the speed of fans can be controlled by moving the regulator. So, the current flowing through the fan is controlled by regulating the resistance through the regulator. Secondly, Ohm's Law is also used in electric heaters. These heaters have a metal coil that has a high resistance that permits a certain amount of current to flow through them to provide the required heat. And lastly, mobile and laptop chargers use Ohm's Law for their basic functionality. Mobile and Laptop chargers use DC power supply in the operation. DC power supply provides a variable output voltage based on the resistance and the overall working is controlled by Ohm’s law."
