Year,Semester,Class,Type,Section,Alma ID,Essay: 2
2021,Summer,PHYS 0232,--,1,2090,"My goals for this class are fairly simple, I want to get into the habit of sitting down and really try to study the material. I've never been much of a student who depended on studying, I'm mostly all one and done. So I want to develop the habit of studying and just being more prepared since I know the classes will only get tougher from here. I have began to try and change some of the bad habits I have on a daily basis like immediately checking my phone when I wake up and scrolling for hours or distracting myself from actually paying attention to a class. I took this summer course to try and change these habits as well as going to bed early so that I wake up fully rested and prepared for class. I've began going to the gym in the early mornings at around 5-6 am, making sure that I arrive before class that way I can ensure that I am fully awake especially after some exercise. This gives me a lot of time afterwards to try and study for my summer courses and really dive into the material, so far the change has been smooth. I do feel like I am more aware of the amount of time I have to sort things out so I am hoping that I will be able to manage the time to study. "
2021,Summer,PHYS 0232,--,1,3044,"My goals are to be able to pass this semester with good standing grades, I am not expecting to get A+ in all my classes but I am hoping to at least get a passing grade. This class can help me achieve these goals by helping me build a stronger foundation for Physics. I can understand physics better by applying it in class, and working on multiple problems that can help me better understand physics. Although it does not directly correlate with my major being a Computer Science major but it lets me understand things that go with my major. During class time I'm able to work on lab explorations which help with the work load. I also get to ask for help from students in other classes that have different professors. A goal I have outside of this class would be to be able to get an internship within my major! I know summer is half way done but it still matters that I try. I'm also part of the Microsoft summer program and I want to be able to network during that time as well."
2021,Summer,PHYS 0232,--,1,2118,"My goals for myself, in general, would be to get a degree in civil engineering and pursuing transportation engineering where I can plan and build motorways or tunnels for civilians. Another goal would be to maintain my grades at a good level, meaning As and Bs, but during the pandemic, I had struggled to maintain high grades as it was hard to learn and really study on one's own. Another goal is to pass this class with a relatively good grade. This course can help me with achieving these certain goals by understanding the curriculum and following step by step with laboratory procedures. With this class, I am able to learn theoretical laws and cycles on how the earth and other factors function.  Also, passing this class will help me move onto the next physics course which will help me with achieving my goal with a bachelor's degree. "
2021,Summer,PHYS 0232,--,1,3059,"In terms of educational goals specifically, I have always wanted to know more about graphics programming and physics simulation in a games setting, and physics has always been very close to these goals. I already have been learning a lot about the equations necessary to simulating motion, but being able to go into the physics of computers themselves I expect to also be helpful. I haven't seen as much of this second point come up yet, but I believe I will be able to connect it more to my computer science courses later on, especially when I learn about machine structures and operating systems and low level programming concepts in general. In regards to the first topic, much of this was covered in the previous physics class which was mechanics, but I expect more to come in both linear algebra, statistics, and in more of this physics class as well."
2021,Summer,PHYS 0232,--,1,3041,"This course is meant to help me prepare for medical school applications. My goal is to become a practitioner of pediatrics. Currently, I work in education. As a pre-K teacher. I feel strongly that health professionals and educators must work together to meet the physical and mental health needs of our children. I know physics is an important foundation for medicine. I am looking forward to the day when a physics topic shows its relevance during a human biology lecture or a medical technology course. "
2021,Summer,PHYS 0232,--,1,3052,"What are my goals and how can this class help me achieve these goals? knowing what my goal is a very important thing that keeps me going but from time to time I lose track of it. I am a computer Science major and I honestly sometimes think all the other classes I take are just a wast of my time as , I want to become a software engineer and I mainly want to learn how to code and it seems all the other classes in the curriculum just seem to be in the way of that , hurdles that I would have to pass to get to my goal I have thought so many times that I would become even a better software engineer if it wasn't for this mandatory classes that have nothing to do with computer science, so I thought. I have often felt that way when taking physics 220, as I ofter thought topics like acceleration , force and gravity have nothing to do with programming. this class on the other hand was the first time I realized  learning about electricity , circuits and all will definitely help me when I am sure I will take a hard ware class that I would have to learn circuits and all. so yeah for the first time I think this class would help me achieve my goal. "
2021,Summer,PHYS 0232,--,1,3055,"My goal right now is to get my BS in computer science and this course is part of the requirement. I would say passing is my goal but that doesn't mean that I don't want to perform well in the class or just scrape by. I have so far enjoyed the material and the topics discussed, I hope my enjoyment of the class continues. I do find the topics in physics very interesting and I do want to learn more about physics. However I don't think that the physics course will apply to my field of work after this class is over. I will probably continue to study physics in a casual manner and I am open to being surprised if some physics topics crop up in my field of work in the future. I find my fascination with the subject more along the lines of concepts rather than the actual math behind them."
2021,Summer,PHYS 0232,--,1,3061,"My current goal is to graduate SFSU with a Bachelor's in computer science.  This class is part of the requirement for my major, however I've always had an interest in physics.  In high school, one of my favorite subject was physics because my teacher was very enthusiastic and always put effort into teaching his class.  His teachings acted as a bridge for my experience with college physic courses.  "
2021,Summer,PHYS 0232,--,1,2521,"I really just want to have a firm grip on physical concepts since it will inherently help me understand how the world works in a better way. Because of this, I would say my goal is to understand the world better and have more knowledge of why things happen when they do. This class, in particular, is a bit different in that it covers electricity and magnetism, but it still has that significant importance in which the ideas we take away and learn from this class will apply to real life scenarios that involve things such as circuits, batteries, etc. This class will help build a foundation on how electrical mechanisms function, which definitely will be useful for me since I do plan to work in the physics field in the future."
2021,Summer,PHYS 0232,--,1,2456,"In terms of goals, I have many goals that I want to achieve. one of the most important is to understand electricity and how does it work.. because I'm an electrical engineering major and being able to understand electricity is very important to me.. my second goal is being able to examine and going through things that can be taught on labs, things that make me visualize the concepts. I believe from the order of the concepts on this class and from the work we do together, and the effective simulations that will link the ideas from the lecture section to meet the practical part on the lab, finishing with a good understanding of the concepts. since we are studying online i believe a lot of the work is approaching less than it should be so i believe this class will complete the picture through group working. "
2021,Summer,PHYS 0232,--,1,3068,"What are my goals and how can this class help me achieve these goals?  My goals in general is to graduate with computer science degree , find a good and well paid job. And become the best programmer there ever been, even though this class might not help me much achieving this goals ,  I feel like this class will teach me communication skills with my teammates and socializing with group of people deciding on solution to the problem. I will achieve my goals by studying hard and trying to get good grades in all my classes as well as to get my diploma in near future.This class is a bit challenging which might help me in my future when I will be facing challenging situations , but the challenges that this class is facing me against are different from what I will be faced in my workplace therefore I feel like this class does help in a way but also it is lots of stress especially when we are doing online learning"
2021,Summer,PHYS 0232,--,1,3076,one of my biggest goals is to learn how electric fields work. I have been struggling through a lot of projects when it comes to electric work in the engineering field. this class will help me understand the basics of how electricity work which will help me reach my goals in the engineering field. I would love to get as much as possible of information about electrics so i can achieve my goals. electricity is all around not just in my projects as an engineer. visualizing the concept of electricity is one of my biggest points in this class and  will help in many points. the components of electricity which are the basics are really important to me especially when they relate to my goals somehow in my major as an engineer.
2021,Summer,PHYS 0232,--,1,3070,"My goals are to pass all my classes this semester so that I could be successful in the future. I feel like physics is more about logical thinking than memorizing equations and concepts.  I would have to spend hours and hours practicing problems from my math classes and coding classes. As I practice more and more, I will gradually improve is what I believe. Since we are in online learning due to the pandemic, it feels harder for me to attend and focus on classes. Sometimes I am behind in classes so I would have to go back and watch the lectures. As I aspire to become a software engineer in the future, logical thinking is a very important thing to have. Though since I aspire to be a software engineer, I believe that the actual subjects I learn in this class will not be required in the future. In order to keep up with my classes, I have decided to make a schedule that I strictly follow. "
2021,Summer,PHYS 0232,--,1,3051,"I want to get an A in this class. But I also have other goals in this class. I want to learn a little bit about hardware. Being a computer science major it is important to have at least some understanding about the materials we can work with. Although we might not directly work with hardware, it is still important to understand. We use a lot of these electric devices every day, and we continue to use them without even realizing how they work. Whether it is a phone or a lawnmower they all use power, and most people just ignore how they work and just go with the flow never understanding their own tools. I just want to learn more about our world so that I am just not brainlessly doing random things every day."
2021,Summer,PHYS 0232,--,1,2104,"In terms of my academic goals, this class will help me get my degree. My degree plan is kind of messed up right now since I took my major classes in a weird order so now my prerequisites don’t line up conveniently for upcoming semesters. That’s why I decided to take summer classes to fix my schedule so taking this class right now will help make future semesters easier to plan. In terms of my personal/work related goals, this class can help me gain a better understanding of electronics so I can apply this knowledge to my personal projects and expand the types of projects I can do at work. I work at a makerspace as a technician and I’m limited to operating machines and doing wood/plastic work. Hopefully this class will help me at least better understand the equipment I’m working with and help me feel more comfortable with exploring metal and electric work."
2021,Summer,PHYS 0232,--,1,2113,"What are my goals and how can this class help me achieve these goals?Goals are always important and when you are in college it helps to have mindset goals. If you want to succeed, you need to set goals. Without goals you lack focus and direction. Goal setting not only allows you to take control of your life's direction; it also provides you a benchmark for determining whether you are actually succeeding. Think about it: having a million dollars in the bank is only proof of success if one of your goals is to amass riches. If your goal is to practice acts of charity, then keeping the money for yourself is suddenly contrary to how you would define success. To accomplish your goals, however, you need to know how to set them. You can't simply say, ""I want"" and expect it to happen. Goal setting is a process that starts with careful consideration of what you want to achieve, and ends with a lot of hard work to actually do it. In between, there are some very well-defined steps that transcend the specifics of each goal. Knowing these steps will allow you to formulate goals that you can accomplish.Setting goals that relate to the high priorities in your life. Without this type of focus, you can end up with far too many goals, leaving you too little time to devote to each one. Goal achievement requires commitment, so to maximize the likelihood of success, you need to feel a sense of urgency and have an ""I must do this"" attitude. When you don't have this, you risk putting off what you need to do to make the goal a reality. This in turn leaves you feeling disappointed and frustrated with yourself, both of which are de-motivating. And you can end up in a very destructive ""I can't do anything or be successful at anything"" frame of mind.In other words, don’t place the hope of future success in the hands of some wizard’s wand. Relying on someone or something to save you only brings a sense of victimization that paralyzes your ability to think clearly, creatively and quickly. Instead, take charge of shaping your own circumstances, and good, positive, game-changing things will begin to happen. It is very important to have goals! "
2021,Summer,PHYS 0232,--,1,3060,"My goals for this class is to help me in succeeding in my Physics 230 class. So far, I’ve been very confused about some of the topics introduced to us in the Physics 230 class because they are new to me and we just don’t have enough time in class for the teacher to go over it in depth. But, the things I had trouble understanding in class like vectors and vector arithmetic, position vs time, velocity vs time, and acceleration vs time graphs. But, the labs thankfully have significantly helped me understand these concepts. Moving forward, the only thing I can do for this class to help me in my goals of succeeding in Physics 230 is to, first of all, be on top of Physics 230, and secondly to come to the lab lecture prepared and ready to learn. I think it’s also important to communicate with group members and be open to learning with them because they can help and you can help them the same."
2021,Summer,PHYS 0232,--,1,3075,My goal right now is to graduate and find a well-paying job. This class will definitely help me graduate as it is one of my major requirements. I am not sure how helpful it will be with the job I end up doing. Other than that if I end up getting into a hands-on engineering job the course material will be very important and helpful. If I land a strictly coding job then not so much. Even if this knowledge does not relate to my future work I still want to learn about this stuff as I am using it all the time every day. 
2021,Summer,PHYS 0232,--,1,3050,"My goal in this class is to perform to best of my ability in general to get the best possible grade In this class, but also learn a lot about physics in the end since I really enjoy concepts such electricity and magnet I really can use this knowledge as a computer scientist when I am dealing with electrical component on a computer, server and etc..I really want to actually understand this at this stage of my life  as a lot of people use electrical devices everyday without consideration of Physics behind it . I hope to change this behavior for myself and achieve the goal of understand the concepts in electricity such as capacitors, resistance in order to feel confident when talking about physics concept with my friends and colleagues . But my main goal in this class is to explore all the concepts in physics and be able to visualize it , because for me personally part of my learning experience is that in order to implement a concept or law I have to visualize it and I can achieve this goal I would significantly do great job in my learning experience"
